title,abstract,new_catalysis_type,new_application_theme,standard_class,cited_by_patent,importance_score,TRL,commercial_potential,climate_solution,impactful,neglectedness
Condensation of Indole with Isatin over AlCl&lt;sub&gt;3&lt;/sub&gt;/Mesoporous Aluminosilicate,"Aluminium chloride immobilized on mesoporous aluminosilicate was investigated as catalysts in the condensation of isatin with indole. AlCl3/mesoporous aluminosilicate (AlCl3/AM) catalysts were prepared by impregnation of 1, 5, 10 and 15 wt% AlCl3 on the surface of mesoporous aluminosilicate. A maximum conversion of isatin was achieved using 15% AlCl3/AM catalyst whereas the highest selectivity of 68.97% towards trisindoline was obtained using pure AM. The activity of the catalysts was depended on their acid site number and surface area. The number of Brønsted acid and the surface area affected to the conversion of isatin while the total acidity and the number of Lewis acid influenced the selectivity.",2,1,4,1,3,3,4,2,3,5
Copper‐Mediated <i>N</i>‐Trifluoromethylation of <i>O</i>‐Benzoylhydroxylamines,"Abstract The use of trifluoromethyl containing compounds is well established within medicinal chemistry, with a range of approved drugs containing C −CF 3 and O −CF 3 moieties. However, the utilisation of the N −CF 3 functional group remains relatively unexplored. This may be attributed to the challenging synthesis of this unit, with many current methods employing harsh conditions or less accessible reagents. A robust methodology for the N ‐trifluoromethylation of secondary amines has been developed, which employs an umpolung strategy in the form of a copper‐catalysed electrophilic amination. The method is operationally simple, uses mild, inexpensive reagents, and has been used to synthesise a range of novel, structurally complex N −CF 3 containing compounds.",3,5,4,1,3,3,5,1,4,7
Optofluidic Photonic Crystal Fiber Microreactors for In Situ Studies of Carbon Nanodot-Driven Photoreduction,"Performing quantitative in situ spectroscopic analysis on minuscule sample volumes is a common difficulty in photochemistry. To address this challenge, we use a hollow-core photonic crystal fiber (HC-PCF) that guides light at the center of a microscale liquid channel and acts as an optofluidic microreactor with a reaction volume of less than 35 nL. The system was used to demonstrate in situ optical detection of photoreduction processes that are key components of many photocatalytic reaction schemes. The photoreduction of viologens (XV2+) to the radical XV•+ in a homogeneous mixture with carbon nanodot (CND) light absorbers is studied for a range of different carbon dots and viologens. Time-resolved absorption spectra, measured over several UV irradiation cycles, are interpreted with a quantitative kinetic model to determine photoreduction and photobleaching rate constants. The powerful combination of time-resolved, low-volume absorption spectroscopy and kinetic modeling highlights the potential of optofluidic microreactors as a highly sensitive, quantitative, and rapid screening platform for novel photocatalysts and flow chemistry in general.",6,6,4,1,3,3,5,6,7,6
Simultaneous hypercrosslinking and functionalization of polyHIPEs for use as coarse powder catalyst supports,"Porous polymers offer desirable properties for heterogeneous catalysis, such as excellent stability, high active site density, and reusability. However, their synthesis is often complicated, requiring expensive reagents and laborious synthetic processes. We produce organophosphorus functionalized polyHIPEs by the polymerization of particle and surfactant stabilized water-in-styrene/divinylbenzene high internal phase emulsion templates, followed by post-functionalization using low-cost hypercrosslinking strategies. Three hypercrosslinking approaches were investigated, including knitting with an external crosslinker, solvent stitching and Scholl coupling reaction. Each approach's ability to simultaneously create micro/mesoporosity and incorporate organophosphorus moieties into the polyHIPE structure as catalyst anchor sites were assessed, introducing surface areas of up to 410 m2/g and phosphorus concentrations of up to 7.4 wt%. After Pd-loading, the polyHIPEs displayed outstanding catalytic performance in a Suzuki-Miyaura coupling reaction, reaching turnover frequencies of 5722 h−1. The coarse powder form of the polyHIPEs allowed for simple catalyst recovery from the reaction mixture for reuse.",2,5,4,1,3,4,6,5,7,6
Site-Selective C-C Modification of Proteins at Neutral pH Using Organocatalyst-Mediated Cross Aldol Ligations,"The bioconjugation of proteins with small molecules has proved an invaluable strategy for probing and perturbing dynamic biological mechanisms. The general use of chemical methods for the functionalisation of proteins remains limited however by the frequent requirement for complicated reaction partners to be present in large excess, and harsh reaction conditions which are incompatible with many protein scaffolds. Herein we describe a site-selective organocatalyst-mediated protein aldol ligation (OPAL) that affords stable carbon-carbon linked bioconjugates at neutral pH under biocompatible conditions. OPAL enables rapid chemical modification of proteins within an hour using simple aldehyde probes in minimal excess, and is utilised here in the selective affinity tagging of proteins in cell lysate. Furthermore we demonstrate that the b-hydroxy aldehyde product of the OPAL can be functionalised a second time at neutral pH in a subsequent organocatalyst-mediated oxime ligation. This tandem strategy is showcased in the ‘chemical mimicry’ of a previously inaccessible natural dual post-translationally modified protein integral to the pathogenesis of the neglected tropical disease Leishmaniasis. &lt;br&gt;",0,3,4,1,3,3,5,0,6,7
"Acidic nanomaterials (TiO<sub>2</sub>, ZrO<sub>2</sub>, and Al<sub>2</sub>O<sub>3</sub>) are coke storage components that reduce the deactivation of the Pt–Sn/γ-Al<sub>2</sub>O<sub>3</sub> catalyst in propane dehydrogenation","Pt–Sn/γ-Al<sub>2</sub>O<sub>3</sub> catalysts were physically mixed with various nanostructured metal oxides (TiO<sub>2</sub>, ZrO<sub>2</sub>, and Al<sub>2</sub>O<sub>3</sub>) and investigated as catalysts for propane dehydrogenation at 550 °C and atmospheric pressure.",2,4,4,1,3,3,5,6,7,4
Guest Encapsulation Within Surface-Adsorbed Self-Assembled Cages,"Coordination cages encapsulate a wide variety of guests in the solution state. This ability renders them useful for applications such as catalysis and the sequestration of precious materials. Here we report a simple and general method for the immobilisation of coordination cages on alumina. Cage loadings were quantified via adsorption isotherms and guest displacement assays demonstrated that the adsorbed cages retained the ability to encapsulate and separate guest and non-guest molecules. Finally, we used a system of two cages adsorbed on to different regions of alumina to stabilise and separate a pair of Diels-Alder reagents. The addition of a single competitive guest resulted in the controlled release of the reagents, thus triggering their reaction. We envisage this method of coordination cage immobilisation on solid phases to be applicable to the extensive library of reported cages, enabling new applications based upon selective solid-phase molecular encapsulation.",2,5,4,1,3,3,5,2,4,6
Catalytic reductive N-alkylation of amines using carboxylic acids,We report a catalytic reductive alkylation reaction of primary or secondary amines with carboxylic acids. The two-phase process involves silane mediated direct amidation followed by catalytic reduction.,3,5,4,1,3,3,5,2,4,6
Visible-Light-Active BiOI/TiO<sub>2</sub> Heterojunction Photocatalysts for Remediation of Crude Oil-Contaminated Water,"In this study, BiOI-sensitized TiO2 (BiOI/TiO2) nanocomposites with different levels of BiOI deposited via sequential ionic layer adsorption and reaction (SILAR) have been explored for the degradation of methyl orange, 4-chlorophenol (4-CP), and crude oil in water under visible (>400 nm) irradiation with excellent degradation performance. The reaction progress for methyl orange and 4-chlorophenol was monitored by a UV-vis spectrophotometer, and the degradation of the crude oil hydrocarbons was determined by GC-MS. The BiOI/TiO2 heterojunction improves separation of photogenerated charges, which enhances the degradation efficiency. Evaluation of the visible-light photocatalytic performance of the synthesized catalysts against methyl orange degradation confirmed that four SILAR cycles are the optimal deposition condition for the best degradation efficiency. The efficiency was further confirmed by degrading 4-CP and crude oil, achieving 38.30 and 85.62% degradation, respectively, compared with 0.0% (4-CP) and 70.56% (crude oil) achieved by TiO2. The efficiency of TiO2 in degrading crude oil was mainly due to adsorption along with photolysis. This study provides a simple and cost-effective alternative to traditional remediation methods requiring high energy consumption for remediation of crude oil-polluted water and refinery wastewater using visible-light photocatalysis along with adsorption.",6,6,4,1,3,3,6,8,7,5
Grafted iron(<scp>iii</scp>) ions significantly enhance NO<sub>2</sub> oxidation rate and selectivity of TiO<sub>2</sub> for photocatalytic NO<sub>x</sub> abatement,"By grafting small amounts of iron ions onto TiO<sub>2</sub>, the rate of photocatalytic oxidation of NO<sub>2</sub> is increased by a factor of 9.",6,6,4,1,3,3,5,8,7,6
"Predicting Regioselectivity of AO, CYP, FMO, and UGT Metabolism Using Quantum Mechanical Simulations and Machine Learning","Unexpected metabolism in modification and conjugation phases can lead to the failure of many late-stage drug candidates or even withdrawal of approved drugs. Thus, it is critical to predict the sites of metabolism (SoM) for enzymes, which interact with drug-like molecules, in the early stages of the research. This study presents methods for predicting the isoform-specific metabolism for human AOs, FMOs, and UGTs and general CYP metabolism for preclinical species. The models use semi-empirical quantum mechanical simulations, validated using experimentally obtained data and DFT calculations, to estimate the reactivity of each SoM in the context of the whole molecule. Ligand-based models, trained and tested using high-quality regioselectivity data, combine the reactivity of the potential SoM with the orientation and steric effects of the binding pockets of the different enzyme isoforms. The resulting models achieve κ values of up to 0.94 and AUC of up to 0.92.",0,3,4,1,3,3,6,0,7,4
Oxygen-deficient photostable Cu<sub>2</sub>O for enhanced visible light photocatalytic activity,"Oxygen vacancies in inorganic semiconductors play an important role in reducing electron-hole recombination, which may have important implications in photocatalysis. Cuprous oxide (Cu2O), a visible light active p-type semiconductor, is a promising photocatalyst. However, the synthesis of photostable Cu2O enriched with oxygen defects remains a challenge. We report a simple method for the gram-scale synthesis of highly photostable Cu2O nanoparticles by the hydrolysis of a Cu(i)-triethylamine [Cu(i)-TEA] complex at low temperature. The oxygen vacancies in these Cu2O nanoparticles led to a significant increase in the lifetimes of photogenerated charge carriers upon excitation with visible light. This, in combination with a suitable energy band structure, allowed Cu2O nanoparticles to exhibit outstanding photoactivity in visible light through the generation of electron-mediated hydroxyl (OH˙) radicals. This study highlights the significance of oxygen defects in enhancing the photocatalytic performance of promising semiconductor photocatalysts.",6,6,4,1,3,3,5,7,6,4
Investigation of polyacrylamide hydrogel‐based molecularly imprinted polymers using protein gel electrophoresis,"Abstract In conjunction with polyacrylamide gel electrophoresis (PAGE), molecular imprinting methods have been applied to produce a multilayer mini‐slab in order to evaluate how selectively and specifically a hydrogel‐based molecularly imprinted polymer (MIP) binds bovine haemoglobin (BHb, ~64.5 kDa). A three‐layer mini‐slab comprising an upper and lower layer and a MIP, or a non‐imprinted control polymer dispersion middle layer has been investigated. The discriminating MIP layer, also based on polyacrylamide, was able to specifically bind BHb molecules in preference to a protein similar in molecular weight such as bovine serum albumin (BSA, ~66 kDa). Protein staining allowed us to visualise the protein retention strength of the MIP layer under the influence of an electric field. This method could be applied to other proteins with implications in effective protein capture, disease diagnostics, and protein analysis.",0,3,4,1,3,3,4,1,5,6
Evolution before genes,"Our current understanding of evolution is so tightly linked to template-dependent replication of DNA and RNA molecules that the old idea from Oparin of a self-reproducing 'garbage bag' ('coacervate') of chemicals that predated fully-fledged cell-like entities seems to be farfetched to most scientists today. However, this is exactly the kind of scheme we propose for how Darwinian evolution could have occurred prior to template replication.We cannot confirm previous claims that autocatalytic sets of organic polymer molecules could undergo evolution in any interesting sense by themselves. While we and others have previously imagined inhibition would result in selectability, we found that it produced multiple attractors in an autocatalytic set that cannot be selected for. Instead, we discovered that if general conditions are satisfied, the accumulation of adaptations in chemical reaction networks can occur. These conditions are the existence of rare reactions producing viable cores (analogous to a genotype), that sustains a molecular periphery (analogous to a phenotype).We conclude that only when a chemical reaction network consists of many such viable cores, can it be evolvable. When many cores are enclosed in a compartment there is competition between cores within the same compartment, and when there are many compartments, there is between-compartment competition due to the phenotypic effects of cores and their periphery at the compartment level. Acquisition of cores by rare chemical events, and loss of cores at division, allows macromutation, limited heredity and selectability, thus explaining how a poor man's natural selection could have operated prior to genetic templates. This is the only demonstration to date of a mechanism by which pre-template accumulation of adaptation could occur.",0,3,4,1,3,1,0,0,3,7
Preparation of Polyfunctional Arylzinc Organometallics in Toluene by Halogen/Zinc Exchange Reactions,"A wide range of polyfunctional diaryl- and diheteroarylzinc species were prepared in toluene within 10 min to 5 h through an I/Zn or Br/Zn exchange reaction using bimetallic reagents of the general formula R'2 Zn⋅2 LiOR (R'=sBu, tBu, pTol). Highly sensitive functional groups, such as a triazine, a ketone, an aldehyde, or a nitro group, were tolerated in these exchange reactions, enabling the synthesis of a plethora of functionalized (hetero)arenes after quenching with various electrophiles. Insight into the constitution and reactivity of these bimetallic mixtures revealed the formation of highly active lithium diorganodialkoxyzincates of type [R'2 Zn(OR)2 Li2 ].",3,5,4,1,3,3,4,2,3,5
Insights into <i>E. coli</i> Cyclopropane Fatty Acid Synthase (CFAS) Towards Enantioselective Carbene Free Biocatalytic Cyclopropanation.,"Abstract Cyclopropane fatty acid synthases (CFAS) are a class of S ‐adenosylmethionine (SAM) dependent methyltransferase enzymes able to catalyse the cyclopropanation of unsaturated phospholipids. Since CFAS enzymes employ SAM as a methylene source to cyclopropanate alkene substrates, they have the potential to be mild and more sustainable biocatalysts for cyclopropanation transformations than current carbene‐based approaches. This work describes the characterisation of E. coli CFAS ( ec CFAS) and its exploitation in the stereoselective biocatalytic synthesis of cyclopropyl lipids. ec CFAS was found to convert phosphatidylglycerol (PG) to methyl dihydrosterculate 1 with up to 58 % conversion and 73 % ee and the absolute configuration (9S,10R) was established. Substrate tolerance of ec CFAS was found to be correlated with the electronic properties of phospholipid headgroups and for the first time ec CFAS was found to catalyse cyclopropanation of both phospholipid chains to form dicyclopropanated products. In addition, mutagenesis and in silico experiments were carried out to identify the enzyme residues with key roles in catalysis and to provide structural insights into the lipid substrate preference of ec CFAS. Finally, the biocatalytic synthesis of methyl dihydrosterculate 1 and its deuterated analogue was also accomplished combining recombinant ec CFAS with the SAM regenerating At HMT enzyme in the presence of CH 3 I and CD 3 I respectively.",0,3,4,1,3,3,5,4,6,7
Nucleophilic Aliphatic Substitution,This chapter contains sections titled: Vinylic Systems Allylic and Various Unsaturated Systems Norbornyl and Closely Related Systems Miscellaneous Polycyclic Systems Epoxide Reactions Other Small Rings Substitution at Elements Other than Carbon Intramolecular Substitution Anchimeric Assistance Ambident Nucleophiles Isotope Effects Gas-phase Reactions Radical Processes Medium Effects Phase-transfer Catalysis and Other Intermolecular Effects Structural Effects S N1 Reactions (Miscellaneous) S N2 Reactions (Miscellaneous) Kinetic Studies (Miscellaneous),5,5,4,1,3,1,0,0,1,5
Controlling Chemoselectivity in the Lithiation of Substituted Aromatic Tertiary Amides,"Angewandte Chemie International EditionVolume 43, Issue 16 p. 2135-2138 Communication Controlling Chemoselectivity in the Lithiation of Substituted Aromatic Tertiary Amides† David R. Armstrong Dr., David R. Armstrong Dr. Department of Pure and Applied Chemistry, University of Strathclyde, 295 Cathedral Street, Glasgow, G1 1XL, UKSearch for more papers by this authorSally R. Boss, Sally R. Boss Department of Chemistry, University of Cambridge, Lensfield Road, Cambridge, CB2 1EW, UK, Fax: (+44) 1223-336-362Search for more papers by this authorJonathan Clayden Prof., Jonathan Clayden Prof. Department of Chemistry, University of Manchester, Oxford Road, Manchester, M13 9PL, UKSearch for more papers by this authorRobert Haigh Dr., Robert Haigh Dr. Department of Chemistry, University of Cambridge, Lensfield Road, Cambridge, CB2 1EW, UK, Fax: (+44) 1223-336-362Search for more papers by this authorBasel A. Kirmani, Basel A. Kirmani Department of Chemistry, University of Cambridge, Lensfield Road, Cambridge, CB2 1EW, UK, Fax: (+44) 1223-336-362Search for more papers by this authorDavid J. Linton Dr., David J. Linton Dr. Department of Chemistry, University of Cambridge, Lensfield Road, Cambridge, CB2 1EW, UK, Fax: (+44) 1223-336-362Search for more papers by this authorPaul Schooler Dr., Paul Schooler Dr. Department of Chemistry, University of Cambridge, Lensfield Road, Cambridge, CB2 1EW, UK, Fax: (+44) 1223-336-362Search for more papers by this authorAndrew E. H. Wheatley Dr., Andrew E. H. Wheatley Dr. aehw2@cam.ac.uk Department of Chemistry, University of Cambridge, Lensfield Road, Cambridge, CB2 1EW, UK, Fax: (+44) 1223-336-362Search for more papers by this author David R. Armstrong Dr., David R. Armstrong Dr. Department of Pure and Applied Chemistry, University of Strathclyde, 295 Cathedral Street, Glasgow, G1 1XL, UKSearch for more papers by this authorSally R. Boss, Sally R. Boss Department of Chemistry, University of Cambridge, Lensfield Road, Cambridge, CB2 1EW, UK, Fax: (+44) 1223-336-362Search for more papers by this authorJonathan Clayden Prof., Jonathan Clayden Prof. Department of Chemistry, University of Manchester, Oxford Road, Manchester, M13 9PL, UKSearch for more papers by this authorRobert Haigh Dr., Robert Haigh Dr. Department of Chemistry, University of Cambridge, Lensfield Road, Cambridge, CB2 1EW, UK, Fax: (+44) 1223-336-362Search for more papers by this authorBasel A. Kirmani, Basel A. Kirmani Department of Chemistry, University of Cambridge, Lensfield Road, Cambridge, CB2 1EW, UK, Fax: (+44) 1223-336-362Search for more papers by this authorDavid J. Linton Dr., David J. Linton Dr. Department of Chemistry, University of Cambridge, Lensfield Road, Cambridge, CB2 1EW, UK, Fax: (+44) 1223-336-362Search for more papers by this authorPaul Schooler Dr., Paul Schooler Dr. Department of Chemistry, University of Cambridge, Lensfield Road, Cambridge, CB2 1EW, UK, Fax: (+44) 1223-336-362Search for more papers by this authorAndrew E. H. Wheatley Dr., Andrew E. H. Wheatley Dr. aehw2@cam.ac.uk Department of Chemistry, University of Cambridge, Lensfield Road, Cambridge, CB2 1EW, UK, Fax: (+44) 1223-336-362Search for more papers by this author First published: 06 April 2004 https://doi.org/10.1002/anie.200353324Citations: 25 † This work was supported by the U.K. EPSRC (S.R.B., R.H., D.J.L., P.S.) and the University of Cambridge (B.A.K.). Read the full textAboutPDF ToolsRequest permissionExport citationAdd to favoritesTrack citation ShareShare Give accessShare full text accessShare full-text accessPlease review our Terms and Conditions of Use and check box below to share full-text version of article.I have read and accept the Wiley Online Library Terms and Conditions of UseShareable LinkUse the link below to share a full-text version of this article with your friends and colleagues. Learn more.Copy URL Share a linkShare onFacebookTwitterLinked InRedditWechat Abstract Solvent effects control the regioselectivity with which tert-butyllithium deprotonates 2-ethyl-N,N-diisopropyl-1-benzamide. From THF an ortho-lithiated dimer is isolated but from N,N,N′,N′′,N′′pentamethyldiethylenetriamine (pmdeta) a laterally lithiated monomer is obtained (see scheme). Density functional theory (DFT) calculations point to the importance of Lewis base solvation and aggregation state in determining the chemoselectivity. Citing Literature Supporting Information Supporting information for this article is available on the WWW under http://www.wiley-vch.de/contents/jc_2002/2004/z53324_s.pdf or from the author. Please note: The publisher is not responsible for the content or functionality of any supporting information supplied by the authors. Any queries (other than missing content) should be directed to the corresponding author for the article. Volume43, Issue16April 13, 2004Pages 2135-2138 RelatedInformation",5,5,4,1,3,2,2,0,3,5
Synthesis of 5-hydroxymethylfurfural from monosaccharides catalyzed by superacid VNU-11–SO<sub>4</sub> in 1-ethyl-3-methylimidazolium chloride ionic liquid,Superacid VNU-11–SO<sub>4</sub> has been considered as a promising heterogeneous catalyst in the conversion of glucose and fructose to 5-hydroxymethylfurfural (HMF) in ionic liquid.,2,1,4,1,3,3,5,7,6,4
ChemInform Abstract: Short Synthesis of Chiral 4-Substituted (S)-Imidazolinium Salts Bearing Sulfonates and Their Use in γ-Selective Reactions of Allylic Halides with Grignard Reagents.,"Abstract New NHC ligand precursors are synthesized, which serve as highly active catalysts (turnover number about 100) for γ‐selective additions to cinnamyl electrophiles without the need for metal salts.",3,5,4,1,3,3,5,2,4,6
ChemInform Abstract: [2.2]Paracyclophane‐Based Monophosphine Ligand for Palladium‐Catalyzed Cross‐Coupling Reactions of Aryl Chlorides.,"Abstract ChemInform is a weekly Abstracting Service, delivering concise information at a glance that was extracted from about 100 leading journals. To access a ChemInform Abstract of an article which was published elsewhere, please select a “Full Text” option. The original article is trackable via the “References” option.",3,5,4,1,3,3,4,2,3,5
A 3D-Printed Standardized Modular Microfluidic System for Droplet Generation,"Droplet-based microfluidics has a variety of applications, such as material synthesis and single-cell analysis. In this paper, we propose a modular microfluidic system using projection micro-stereolithography three-dimensional (3D) printing technology for droplet generation. All modules are designed using a standard cubic structure with a specific leakage-free connection interface. Versatile droplets, including single droplets, alternating droplets, merged droplets, and Janus particles, have been successfully produced. The droplet size and the generation rate can be flexibly controlled by adjusting the flow rates. The influence of the flow rate fraction between the discrete phase and the continuous phase over the generation of the alternating and merged droplets is discussed. Furthermore, the 'UV curing' module can be employed to solidify the generated droplets to avoid coalescence and fix the status of the Janus particles. The proposed modular droplet generators are promising candidates for various chemical and biological applications, such as single-cell incubation, screening of protein crystallization conditions, synthesis of nanoparticles, and gene delivery. In addition, we envision that more functional modules, e.g., valve, microreactor, and detection modules, could be developed, and the 3D standardized modular microfluidics could be further applied to other complex systems, i.e., concentration gradient generators and clinical diagnostic systems.",4,3,4,1,3,3,7,2,6,5
